{
  "outcome": "PASS",
  "assessor": "human-and-ai-ground-survey",
  "rationale": "The work is isolated to metadata, schemas, deterministic indexes, tests, and manifests in RTS. Adjacent repositories are read-only evidence sources and rollback is a single PR revert.",
  "affected_boundaries": [
    "asset_manifest package",
    "FREEZER records and indexes",
    "CI governed-record checks",
    "public/private repository metadata boundary"
  ],
  "existing_assumptions": [
    "RTS repo remains public",
    "Private repository names and high-level roles are safe approved metadata",
    "No adjacent repository mutation is required",
    "JSON and Python standard library are sufficient"
  ],
  "data_migration": {
    "required": false,
    "notes": "New append-only v001 snapshot only; no existing record is rewritten."
  },
  "external_interfaces": [
    "GitHub repository metadata and file refs as read-only evidence",
    "No runtime API or credential connection"
  ],
  "approval_changes": [
    "Only RTS-FRZ-000004 receives APPROVED authority for this PR",
    "000003 and 000005-000007 remain NOT_APPROVED"
  ],
  "public_documents": [
    "asset_manifest/README.md",
    "docs/implementation/CROSS_REPO_ASSET_MANIFEST_V1_TASK.md"
  ],
  "regression_tests": [
    "python -m asset_manifest.cli verify",
    "python -B -m unittest discover -s tests -v",
    "python -m freezer.cli verify",
    "python -m freezer.build_assessment verify",
    "semantic index rebuild in CI",
    "Unicode Guard"
  ],
  "hidden_dependencies": [
    "FREEZER tests previously assumed a small fixed seed set and may need non-brittle updates",
    "Manifest hashes must be regenerated after any tracked file change",
    "Private repository locators must stay logical and metadata-only"
  ],
  "rollback_boundary": "Revert the Cross-Repo Asset Manifest PR; no adjacent repository or external state is mutated.",
  "completion_conditions": [
    "All 19 repositories represented",
    "24 initial reusable/reference assets classified",
    "Immutable snapshot and three deterministic indexes verified",
    "Privacy, license, ownership, pointer and hash rules tested",
    "Parent/child FREEZER records preserve scope boundaries"
  ],
  "decomposition": {
    "required": false,
    "child_candidates": []
  },
  "risks": [
    "Stale repository refs",
    "Overstating review completeness",
    "Canonical capability naming collisions",
    "Accidental private path disclosure"
  ],
  "preflight_id": "RTS-PF-000004-001",
  "item_id": "RTS-FRZ-000004",
  "preflight_version": 1,
  "item_version_snapshot": 1,
  "item_fingerprint": "35e8c5bef5aa03f03f8f65ca6dcb5f7bae6b0e73f1911ee74dc2eb00ce49e6b7",
  "created_at": "2026-07-24T03:49:46Z"
}
